[
  {
    "recipe_id": "neapolitan_001",
    "style": "neapolitan",
    "source": "https://www.seriouseats.com/basic-neapolitan-pizza-dough-recipe",
    "raw_text": "20 ounces (about 4 cups) bread flour, preferably Italian-style \"OO\"\n.4 ounces kosher salt (about 4 teaspoons)\n.3 ounces (about 2 teaspoons) instant yeast, such as SAF Instant Yeast\n13 ounces water",
    "mapping": {
      "flour": {
        "raw": "20 ounces ... bread flour",
        "method": "to_grams(oz->g); baker's-percentage anchor"
      },
      "flour_type": {
        "raw": "bread flour, preferably Italian-style \"OO\"",
        "method": "match_alias",
        "note": "named 'bread flour' but author prefers Italian-style 00; matched literal name, not preference (text says letter-O 'OO', not digit '00', so alias didn't fire on 00 anyway)"
      },
      "water": {
        "raw": "13 ounces water",
        "method": "to_grams + to_baker_percentage"
      },
      "salt": {
        "raw": ".4 ounces kosher salt (about 4 teaspoons)",
        "method": "to_grams + to_baker_percentage"
      },
      "yeast": {
        "raw": ".3 ounces (about 2 teaspoons) instant yeast",
        "method": "to_grams + to_baker_percentage"
      },
      "yeast_type": {
        "raw": "instant yeast",
        "method": "match_alias"
      },
      "fat": {
        "raw": "(not present in source)",
        "method": "manual",
        "note": "no fat ingredient in source; defaulted to 0"
      },
      "fat_type": {
        "raw": "(not present in source)",
        "method": "manual",
        "note": "no fat ingredient in source; defaulted to 0"
      },
      "sugar": {
        "raw": "(not present in source)",
        "method": "manual",
        "note": "no sugar ingredient in source; defaulted to 0"
      },
      "sugar_type": {
        "raw": "(not present in source)",
        "method": "manual",
        "note": "no sugar ingredient in source; defaulted to 0"
      }
    },
    "flour": 100.0,
    "flour_type": "bread",
    "water": 65.0,
    "salt": 2.0,
    "yeast": 1.5,
    "yeast_type": "instant",
    "fat": 0.0,
    "fat_type": null,
    "sugar": 0.0,
    "sugar_type": null
  },
  {
    "recipe_id": "neapolitan_002",
    "style": "neapolitan",
    "source": "https://www.kingarthurbaking.com/recipes/neapolitan-style-pizza-crust-recipe",
    "raw_text": "2 cups (232g) King Arthur '00' Pizza Flour\n1/8 teaspoon instant yeast or active dry yeast\n1/2 teaspoon granulated sugar\n1 1/4 teaspoons (8g) table salt\n3/4 cup (170g) water, lukewarm, (105 to 115F)",
    "mapping": {
      "flour": {
        "raw": "2 cups (232g) King Arthur '00' Pizza Flour",
        "method": "given gram weight; baker's-percentage anchor"
      },
      "flour_type": {
        "raw": "King Arthur '00' Pizza Flour",
        "method": "match_alias"
      },
      "water": {
        "raw": "3/4 cup (170g) water",
        "method": "given gram weight + to_baker_percentage"
      },
      "salt": {
        "raw": "1 1/4 teaspoons (8g) table salt",
        "method": "given gram weight + to_baker_percentage"
      },
      "yeast": {
        "raw": "1/8 teaspoon instant yeast or active dry yeast",
        "method": "YEAST_DENSITY_G_PER_TSP[instant] + to_baker_percentage",
        "note": "recipe offers instant OR active-dry as interchangeable; took first-listed (instant)"
      },
      "yeast_type": {
        "raw": "instant yeast or active dry yeast",
        "method": "manual (first-listed option)"
      },
      "fat": {
        "raw": "(not present in source)",
        "method": "manual",
        "note": "no fat ingredient in source; defaulted to 0"
      },
      "fat_type": {
        "raw": "(not present in source)",
        "method": "manual",
        "note": "no fat ingredient in source; defaulted to 0"
      },
      "sugar": {
        "raw": "1/2 teaspoon granulated sugar",
        "method": "added SUGAR density constant (sugar_white=0.845 g/mL) + to_grams + to_baker_percentage",
        "note": "no sugar density constant existed in Conversions before this pass; added one"
      },
      "sugar_type": {
        "raw": "granulated sugar",
        "method": "match_alias"
      }
    },
    "flour": 100.0,
    "flour_type": "double_zero",
    "water": 73.2759,
    "salt": 3.4483,
    "yeast": 0.167,
    "yeast_type": "instant",
    "fat": 0.0,
    "fat_type": null,
    "sugar": 0.8976,
    "sugar_type": "white"
  },
  {
    "recipe_id": "neapolitan_003",
    "style": "neapolitan",
    "source": "https://www.seriouseats.com/basic-pizza-dough-for-high-temperature-outdoor-pizza-ovens-5211302",
    "raw_text": "535 g (18.9 ounces) high protein all-purpose flour, such as King Arthur (Baker's percentage: 100%)\n2 g (0.07 ounce; 1/2 teaspoon) instant dry yeast, such as SAF (Baker's percentage: 0.4%)\n360 g (12.7 ounces) water, at 40F (4C) (Baker's percentage: 67%)\n12 g (0.4 ounce; 1 tablespoon) Diamond Crystal kosher salt (Baker's percentage: 2%)\nExtra-virgin olive oil for oiling proofing containers and dough balls",
    "mapping": {
      "flour": {
        "raw": "535 g ... high protein all-purpose flour",
        "method": "given gram weight; baker's-percentage anchor"
      },
      "flour_type": {
        "raw": "high protein all-purpose flour",
        "method": "match_alias",
        "note": "named 'all-purpose' by source despite 'high protein' qualifier (functions more like bread flour); kept source's literal naming"
      },
      "water": {
        "raw": "360 g water",
        "method": "given gram weight + to_baker_percentage"
      },
      "salt": {
        "raw": "12 g Diamond Crystal kosher salt",
        "method": "given gram weight + to_baker_percentage"
      },
      "yeast": {
        "raw": "2 g instant dry yeast",
        "method": "given gram weight + to_baker_percentage"
      },
      "yeast_type": {
        "raw": "instant dry yeast",
        "method": "match_alias"
      },
      "fat": {
        "raw": "Extra-virgin olive oil for oiling proofing containers and dough balls",
        "method": "manual",
        "note": "EVOO used only for oiling containers/dough balls, not mixed into the dough formula; excluded"
      },
      "fat_type": {
        "raw": "Extra-virgin olive oil for oiling proofing containers and dough balls",
        "method": "manual",
        "note": "excluded - not a dough ingredient"
      },
      "sugar": {
        "raw": "(not present in source)",
        "method": "manual",
        "note": "no sugar ingredient in source; defaulted to 0"
      },
      "sugar_type": {
        "raw": "(not present in source)",
        "method": "manual",
        "note": "no sugar ingredient in source; defaulted to 0"
      }
    },
    "flour": 100.0,
    "flour_type": "all-purpose",
    "water": 67.2897,
    "salt": 2.243,
    "yeast": 0.3738,
    "yeast_type": "instant",
    "fat": 0.0,
    "fat_type": null,
    "sugar": 0.0,
    "sugar_type": null
  },
  {
    "recipe_id": "neapolitan_004",
    "style": "neapolitan",
    "source": "https://modernistcuisine.com/wp-content/uploads/2013/04/Neopolitan-Pizza-Dough-3-1024x446.jpg",
    "raw_text": "100% 00 wheat flour\n62% water\n2% honey\n2% salt\n0.5% yeast\n0.5% vital wheat gluten",
    "mapping": {
      "flour": {
        "raw": "100% 00 wheat flour",
        "method": "percentage given directly; baker's-percentage anchor"
      },
      "flour_type": {
        "raw": "00 wheat flour",
        "method": "match_alias"
      },
      "water": {
        "raw": "62% water",
        "method": "percentage given directly"
      },
      "salt": {
        "raw": "2% salt",
        "method": "percentage given directly"
      },
      "yeast": {
        "raw": "0.5% yeast",
        "method": "percentage given directly"
      },
      "yeast_type": {
        "raw": "yeast",
        "method": "manual (unspecified type)",
        "note": "no yeast type stated at all; assumed instant as the default"
      },
      "fat": {
        "raw": "(not present)",
        "method": "manual",
        "note": "vital wheat gluten (0.5%) is not fat and has no field in this schema; excluded, visible in raw_text"
      },
      "fat_type": {
        "raw": "(not present in source)",
        "method": "manual",
        "note": "no fat ingredient in source; defaulted to 0"
      },
      "sugar": {
        "raw": "2% honey",
        "method": "percentage given directly"
      },
      "sugar_type": {
        "raw": "honey",
        "method": "match_alias"
      }
    },
    "flour": 100.0,
    "flour_type": "double_zero",
    "water": 62.0,
    "salt": 2.0,
    "yeast": 0.5,
    "yeast_type": "instant",
    "fat": 0.0,
    "fat_type": null,
    "sugar": 2.0,
    "sugar_type": "honey"
  },
  {
    "recipe_id": "neapolitan_005",
    "style": "neapolitan",
    "source": "https://www.pizzamaking.com/forum/index.php?msg=202047",
    "raw_text": "100% Caputo (my typical batch is ~1.3kg flour)\n62.5% Water at about 40-45F (play with this over time in a range of 60-64%)\n3.0% Salt (I would not go lower than 2.5% or more than maybe 3.1%)\n1.3% Ischia Culture (fully active) NO FRESH YEAST, IDY, or ADY!!! Trust your culture. The hydration and flour you use in your culture don't matter much at quantities this low.",
    "mapping": {
      "flour": {
        "raw": "100% Caputo (my typical batch is ~1.3kg flour)",
        "method": "percentage given directly; baker's-percentage anchor"
      },
      "flour_type": {
        "raw": "Caputo",
        "method": "match_alias",
        "note": "brand implies tipo 00 (Caputo's standard pizza flour); not stated explicitly as '00'"
      },
      "water": {
        "raw": "62.5% Water ... (range of 60-64%)",
        "method": "manual (headline value, not range)",
        "note": "source gives both a headline % and a wider experimental range; took the headline value"
      },
      "salt": {
        "raw": "3.0% Salt (would not go lower than 2.5% or more than maybe 3.1%)",